{
  "id": "pricing-copy-experiment",
  "title": "Pricing Copy Experiment Loop",
  "category": "product",
  "summary": "Improves pricing-page copy through hypothesis, controlled measurement, and guardrails.",
  "tags": [
    "pricing",
    "copy",
    "experiment"
  ],
  "useCases": [
    "pricing page optimization",
    "plan comparison clarity",
    "conversion experiments"
  ],
  "riskLevel": "high",
  "inputs": [
    "pricing_page",
    "hypothesis",
    "success_metric"
  ],
  "steps": [
    "Write the user confusion or conversion hypothesis and define success plus guardrail metrics.",
    "Audit current copy for unclear plan boundaries, unsupported claims, and mismatch with billing reality.",
    "Create a minimal copy change that clarifies value without changing actual pricing or terms.",
    "Run the approved measurement plan and monitor support, refunds, and complaint signals.",
    "Keep, revise, or revert based on evidence rather than preference."
  ],
  "checks": [
    "billing reality verified",
    "legal or policy claims reviewed",
    "success and guardrails defined",
    "results interpreted consistently"
  ],
  "stopConditions": [
    "experiment reaches decision threshold",
    "guardrail metric regresses",
    "approval missing"
  ],
  "evidence": [
    "hypothesis",
    "copy diff",
    "metric report",
    "decision note"
  ],
  "humanApproval": [
    "changing prices or terms",
    "publishing regulated claims",
    "running user-facing experiment"
  ],
  "version": "0.1.0",
  "updated": "2026-06-20",
  "author": "Palette Lab",
  "license": "MIT",
  "compatibleAgents": [
    "codex",
    "github-copilot",
    "claude",
    "claude-code",
    "cursor",
    "aider",
    "goose",
    "opencode",
    "gemini-cli",
    "google-ai-studio",
    "google-antigravity"
  ],
  "prompt": "Use the Pricing Copy Experiment Loop for [pricing_page, hypothesis, success_metric].\n\nFirst define the task boundary, success criteria, allowed actions, required evidence, risk level, and budget. Work in bounded iterations. In each iteration:\n- Write the user confusion or conversion hypothesis and define success plus guardrail metrics.\n- Audit current copy for unclear plan boundaries, unsupported claims, and mismatch with billing reality.\n- Create a minimal copy change that clarifies value without changing actual pricing or terms.\n- Run the approved measurement plan and monitor support, refunds, and complaint signals.\n- Keep, revise, or revert based on evidence rather than preference.\n\nQuality gates before completion:\n- billing reality verified\n- legal or policy claims reviewed\n- success and guardrails defined\n- results interpreted consistently\n\nStop when one of these is true:\n- experiment reaches decision threshold\n- guardrail metric regresses\n- approval missing\n\nFinish with:\n- hypothesis\n- copy diff\n- metric report\n- decision note\n\nEscalate for human approval before: changing prices or terms, publishing regulated claims, running user-facing experiment."
}
