{
  "id": "red-green-regression",
  "title": "Red Green Regression Loop",
  "category": "engineering",
  "summary": "Prevents silent bug recurrence by forcing a failing regression test before any fix is accepted.",
  "tags": [
    "testing",
    "tdd",
    "regression"
  ],
  "useCases": [
    "bug fixes",
    "library behavior changes",
    "stabilizing brittle features"
  ],
  "riskLevel": "low",
  "inputs": [
    "failing_behavior",
    "test_scope",
    "budget"
  ],
  "steps": [
    "Translate the failing behavior into a minimal test that fails for the right reason.",
    "Run the test alone and inside the relevant suite to confirm the red state is meaningful.",
    "Patch the implementation with the narrowest change that turns the test green.",
    "Broaden only the tests needed to cover adjacent realistic cases.",
    "Rerun the suite and review whether the test would have caught the original issue."
  ],
  "checks": [
    "test fails before fix",
    "test passes after fix",
    "test assertion targets behavior not implementation trivia",
    "relevant suite passes"
  ],
  "stopConditions": [
    "regression is protected and green",
    "behavior cannot be made deterministic",
    "budget ends"
  ],
  "evidence": [
    "red output",
    "green output",
    "test file path",
    "risk notes"
  ],
  "humanApproval": [
    "changing public API expectations",
    "removing existing tests"
  ],
  "version": "0.1.0",
  "updated": "2026-06-20",
  "author": "Palette Lab",
  "license": "MIT",
  "compatibleAgents": [
    "codex",
    "github-copilot",
    "claude",
    "claude-code",
    "cursor",
    "aider",
    "goose",
    "opencode",
    "gemini-cli",
    "google-ai-studio",
    "google-antigravity"
  ],
  "prompt": "Use the Red Green Regression Loop for [failing_behavior, test_scope, budget].\n\nFirst define the task boundary, success criteria, allowed actions, required evidence, risk level, and budget. Work in bounded iterations. In each iteration:\n- Translate the failing behavior into a minimal test that fails for the right reason.\n- Run the test alone and inside the relevant suite to confirm the red state is meaningful.\n- Patch the implementation with the narrowest change that turns the test green.\n- Broaden only the tests needed to cover adjacent realistic cases.\n- Rerun the suite and review whether the test would have caught the original issue.\n\nQuality gates before completion:\n- test fails before fix\n- test passes after fix\n- test assertion targets behavior not implementation trivia\n- relevant suite passes\n\nStop when one of these is true:\n- regression is protected and green\n- behavior cannot be made deterministic\n- budget ends\n\nFinish with:\n- red output\n- green output\n- test file path\n- risk notes\n\nEscalate for human approval before: changing public API expectations, removing existing tests."
}
