{
  "id": "dataset-contract-loop",
  "title": "Dataset Contract Loop",
  "category": "data",
  "summary": "Defines and enforces dataset expectations before downstream analysis, training, or automation depends on it.",
  "tags": [
    "data-quality",
    "contracts",
    "pipelines"
  ],
  "useCases": [
    "analytics pipelines",
    "ML datasets",
    "agent memory exports"
  ],
  "riskLevel": "medium",
  "inputs": [
    "dataset",
    "consumer",
    "quality_thresholds"
  ],
  "steps": [
    "Identify the dataset owner, consumers, freshness expectations, schema, privacy class, and allowed uses.",
    "Write contract checks for schema, nulls, ranges, uniqueness, lineage, freshness, and sampling assumptions.",
    "Run checks against current data and inspect representative failures.",
    "Fix the producer, transform, or consumer assumption that causes the highest-risk contract violation.",
    "Automate the contract check before downstream jobs consume the data."
  ],
  "checks": [
    "owner and consumer recorded",
    "schema and freshness tested",
    "privacy class set",
    "contract automated",
    "failures are actionable"
  ],
  "stopConditions": [
    "contract passes and is enforced",
    "ambiguous data ownership blocks fix",
    "consumer accepts documented risk"
  ],
  "evidence": [
    "contract file",
    "check output",
    "failure samples",
    "automation config"
  ],
  "humanApproval": [
    "using personal data",
    "changing data retention",
    "weakening quality thresholds"
  ],
  "version": "0.1.0",
  "updated": "2026-06-20",
  "author": "Palette Lab",
  "license": "MIT",
  "compatibleAgents": [
    "codex",
    "github-copilot",
    "claude",
    "claude-code",
    "cursor",
    "aider",
    "goose",
    "opencode",
    "gemini-cli",
    "google-ai-studio",
    "google-antigravity"
  ],
  "prompt": "Use the Dataset Contract Loop for [dataset, consumer, quality_thresholds].\n\nFirst define the task boundary, success criteria, allowed actions, required evidence, risk level, and budget. Work in bounded iterations. In each iteration:\n- Identify the dataset owner, consumers, freshness expectations, schema, privacy class, and allowed uses.\n- Write contract checks for schema, nulls, ranges, uniqueness, lineage, freshness, and sampling assumptions.\n- Run checks against current data and inspect representative failures.\n- Fix the producer, transform, or consumer assumption that causes the highest-risk contract violation.\n- Automate the contract check before downstream jobs consume the data.\n\nQuality gates before completion:\n- owner and consumer recorded\n- schema and freshness tested\n- privacy class set\n- contract automated\n- failures are actionable\n\nStop when one of these is true:\n- contract passes and is enforced\n- ambiguous data ownership blocks fix\n- consumer accepts documented risk\n\nFinish with:\n- contract file\n- check output\n- failure samples\n- automation config\n\nEscalate for human approval before: using personal data, changing data retention, weakening quality thresholds."
}
