{
  "id": "source-grounded-brief",
  "title": "Source Grounded Brief Loop",
  "category": "content",
  "summary": "Creates a concise brief that every important claim can trace back to a credible source.",
  "tags": [
    "research",
    "brief",
    "citations"
  ],
  "useCases": [
    "market briefs",
    "competitive analysis",
    "executive summaries"
  ],
  "riskLevel": "medium",
  "inputs": [
    "question",
    "source_requirements",
    "audience"
  ],
  "steps": [
    "Write the decision the brief will support and the claims that matter most.",
    "Collect primary or high-quality sources, preferring current official data when facts can change.",
    "Draft only claims supported by sources, and mark uncertainty rather than filling gaps.",
    "Challenge the brief with at least one disconfirming or alternative source where applicable.",
    "Trim to the audience need while preserving source links and dates."
  ],
  "checks": [
    "load-bearing claims cited",
    "source dates checked",
    "uncertainty marked",
    "contrary evidence considered",
    "brief is decision-ready"
  ],
  "stopConditions": [
    "brief answers the decision question",
    "sources are insufficient",
    "time-sensitive source cannot be verified"
  ],
  "evidence": [
    "source list",
    "claim-to-source map",
    "draft brief",
    "uncertainty notes"
  ],
  "humanApproval": [
    "publishing externally",
    "making regulated claims"
  ],
  "version": "0.1.0",
  "updated": "2026-06-20",
  "author": "Palette Lab",
  "license": "MIT",
  "compatibleAgents": [
    "codex",
    "github-copilot",
    "claude",
    "claude-code",
    "cursor",
    "aider",
    "goose",
    "opencode",
    "gemini-cli",
    "google-ai-studio",
    "google-antigravity"
  ],
  "prompt": "Use the Source Grounded Brief Loop for [question, source_requirements, audience].\n\nFirst define the task boundary, success criteria, allowed actions, required evidence, risk level, and budget. Work in bounded iterations. In each iteration:\n- Write the decision the brief will support and the claims that matter most.\n- Collect primary or high-quality sources, preferring current official data when facts can change.\n- Draft only claims supported by sources, and mark uncertainty rather than filling gaps.\n- Challenge the brief with at least one disconfirming or alternative source where applicable.\n- Trim to the audience need while preserving source links and dates.\n\nQuality gates before completion:\n- load-bearing claims cited\n- source dates checked\n- uncertainty marked\n- contrary evidence considered\n- brief is decision-ready\n\nStop when one of these is true:\n- brief answers the decision question\n- sources are insufficient\n- time-sensitive source cannot be verified\n\nFinish with:\n- source list\n- claim-to-source map\n- draft brief\n- uncertainty notes\n\nEscalate for human approval before: publishing externally, making regulated claims."
}
