{
  "id": "ci-flake-burndown",
  "title": "CI Flake Burndown Loop",
  "category": "engineering",
  "summary": "Finds and removes flaky test causes while preserving coverage and signal.",
  "tags": [
    "ci",
    "flaky-tests",
    "reliability"
  ],
  "useCases": [
    "unstable pipelines",
    "slow release gates",
    "test infrastructure cleanup"
  ],
  "riskLevel": "medium",
  "inputs": [
    "ci_job",
    "flake_window",
    "minimum_runs"
  ],
  "steps": [
    "Collect recent failure signatures and cluster them by test, error, environment, and timing pattern.",
    "Choose the highest-impact flake that is actionable within the current permission scope.",
    "Reproduce the flake by stress-running the narrowest target under representative CI conditions.",
    "Fix the root cause such as shared state, timing dependence, network reliance, or order dependence.",
    "Rerun stress tests and the full affected CI job before proposing the change."
  ],
  "checks": [
    "failure cluster documented",
    "stress reproduction attempted",
    "coverage is not reduced",
    "affected job passes repeatedly"
  ],
  "stopConditions": [
    "top flake is fixed with evidence",
    "remaining failures require infrastructure access",
    "no actionable flake remains"
  ],
  "evidence": [
    "failure cluster table",
    "stress command and counts",
    "root-cause explanation",
    "CI links or local equivalent"
  ],
  "humanApproval": [
    "quarantining tests",
    "changing CI capacity",
    "skipping coverage gates"
  ],
  "version": "0.1.0",
  "updated": "2026-06-20",
  "author": "Palette Lab",
  "license": "MIT",
  "compatibleAgents": [
    "codex",
    "github-copilot",
    "claude",
    "claude-code",
    "cursor",
    "aider",
    "goose",
    "opencode",
    "gemini-cli",
    "google-ai-studio",
    "google-antigravity"
  ],
  "prompt": "Use the CI Flake Burndown Loop for [ci_job, flake_window, minimum_runs].\n\nFirst define the task boundary, success criteria, allowed actions, required evidence, risk level, and budget. Work in bounded iterations. In each iteration:\n- Collect recent failure signatures and cluster them by test, error, environment, and timing pattern.\n- Choose the highest-impact flake that is actionable within the current permission scope.\n- Reproduce the flake by stress-running the narrowest target under representative CI conditions.\n- Fix the root cause such as shared state, timing dependence, network reliance, or order dependence.\n- Rerun stress tests and the full affected CI job before proposing the change.\n\nQuality gates before completion:\n- failure cluster documented\n- stress reproduction attempted\n- coverage is not reduced\n- affected job passes repeatedly\n\nStop when one of these is true:\n- top flake is fixed with evidence\n- remaining failures require infrastructure access\n- no actionable flake remains\n\nFinish with:\n- failure cluster table\n- stress command and counts\n- root-cause explanation\n- CI links or local equivalent\n\nEscalate for human approval before: quarantining tests, changing CI capacity, skipping coverage gates."
}
