{
  "id": "open-source-contribution-review",
  "title": "Open Source Contribution Review Loop",
  "category": "operations",
  "summary": "Reviews external contributions for fit, safety, maintainability, and contributor experience.",
  "tags": [
    "open-source",
    "review",
    "maintainers"
  ],
  "useCases": [
    "community PR review",
    "first-time contributors",
    "maintainer triage"
  ],
  "riskLevel": "medium",
  "inputs": [
    "pull_request",
    "project_goals",
    "merge_policy"
  ],
  "steps": [
    "Thank the contributor and summarize the contribution in terms of project goals.",
    "Run automated gates and inspect security, scope, tests, docs, and maintenance burden.",
    "Separate required changes from optional suggestions so review is actionable.",
    "If the contribution is not a fit, explain the reason and offer the smallest helpful next path.",
    "Merge only when gates pass, scope fits, and maintainability risk is acceptable."
  ],
  "checks": [
    "contributor treated respectfully",
    "gates run",
    "scope fit assessed",
    "required changes are specific",
    "security reviewed"
  ],
  "stopConditions": [
    "PR merged, changes requested, or closed with rationale",
    "maintainer decision needed",
    "CI unavailable"
  ],
  "evidence": [
    "review checklist",
    "gate output",
    "comment draft",
    "merge or close rationale"
  ],
  "humanApproval": [
    "rejecting significant community work",
    "changing project direction"
  ],
  "version": "0.1.0",
  "updated": "2026-06-20",
  "author": "Palette Lab",
  "license": "MIT",
  "compatibleAgents": [
    "codex",
    "github-copilot",
    "claude",
    "claude-code",
    "cursor",
    "aider",
    "goose",
    "opencode",
    "gemini-cli",
    "google-ai-studio",
    "google-antigravity"
  ],
  "prompt": "Use the Open Source Contribution Review Loop for [pull_request, project_goals, merge_policy].\n\nFirst define the task boundary, success criteria, allowed actions, required evidence, risk level, and budget. Work in bounded iterations. In each iteration:\n- Thank the contributor and summarize the contribution in terms of project goals.\n- Run automated gates and inspect security, scope, tests, docs, and maintenance burden.\n- Separate required changes from optional suggestions so review is actionable.\n- If the contribution is not a fit, explain the reason and offer the smallest helpful next path.\n- Merge only when gates pass, scope fits, and maintainability risk is acceptable.\n\nQuality gates before completion:\n- contributor treated respectfully\n- gates run\n- scope fit assessed\n- required changes are specific\n- security reviewed\n\nStop when one of these is true:\n- PR merged, changes requested, or closed with rationale\n- maintainer decision needed\n- CI unavailable\n\nFinish with:\n- review checklist\n- gate output\n- comment draft\n- merge or close rationale\n\nEscalate for human approval before: rejecting significant community work, changing project direction."
}
