{
  "id": "model-card-refresh",
  "title": "Model Card Refresh Loop",
  "category": "data",
  "summary": "Keeps an AI model or prompt system card current with capabilities, limits, evals, and risks.",
  "tags": [
    "model-card",
    "ai-governance",
    "evaluation"
  ],
  "useCases": [
    "internal model registry",
    "AI feature launch",
    "prompt system governance"
  ],
  "riskLevel": "high",
  "inputs": [
    "system",
    "eval_results",
    "deployment_context"
  ],
  "steps": [
    "Inventory the current system version, intended users, allowed uses, disallowed uses, dependencies, and deployment context.",
    "Attach the latest evaluation results, known failure modes, safety controls, and monitoring plan.",
    "Compare the card against actual implementation and remove stale claims.",
    "Update risk, privacy, fairness, and security notes based on incidents or new use cases.",
    "Route unresolved high-impact risks to the accountable owner before launch."
  ],
  "checks": [
    "version matches deployment",
    "evals linked",
    "limitations explicit",
    "risks have owners",
    "stale claims removed"
  ],
  "stopConditions": [
    "model card is current and approved",
    "evals are missing",
    "risk owner blocks launch"
  ],
  "evidence": [
    "updated card",
    "eval links",
    "risk table",
    "approval note"
  ],
  "humanApproval": [
    "production launch",
    "expanding allowed use",
    "accepting high-impact risk"
  ],
  "version": "0.1.0",
  "updated": "2026-06-20",
  "author": "Palette Lab",
  "license": "MIT",
  "compatibleAgents": [
    "codex",
    "github-copilot",
    "claude",
    "claude-code",
    "cursor",
    "aider",
    "goose",
    "opencode",
    "gemini-cli",
    "google-ai-studio",
    "google-antigravity"
  ],
  "prompt": "Use the Model Card Refresh Loop for [system, eval_results, deployment_context].\n\nFirst define the task boundary, success criteria, allowed actions, required evidence, risk level, and budget. Work in bounded iterations. In each iteration:\n- Inventory the current system version, intended users, allowed uses, disallowed uses, dependencies, and deployment context.\n- Attach the latest evaluation results, known failure modes, safety controls, and monitoring plan.\n- Compare the card against actual implementation and remove stale claims.\n- Update risk, privacy, fairness, and security notes based on incidents or new use cases.\n- Route unresolved high-impact risks to the accountable owner before launch.\n\nQuality gates before completion:\n- version matches deployment\n- evals linked\n- limitations explicit\n- risks have owners\n- stale claims removed\n\nStop when one of these is true:\n- model card is current and approved\n- evals are missing\n- risk owner blocks launch\n\nFinish with:\n- updated card\n- eval links\n- risk table\n- approval note\n\nEscalate for human approval before: production launch, expanding allowed use, accepting high-impact risk."
}
