{
  "id": "migration-slice-loop",
  "title": "Migration Slice Loop",
  "category": "engineering",
  "summary": "Executes risky migrations through thin reversible slices with verification at each boundary.",
  "tags": [
    "migration",
    "refactor",
    "rollout"
  ],
  "useCases": [
    "database migration",
    "framework migration",
    "service extraction"
  ],
  "riskLevel": "high",
  "inputs": [
    "migration_goal",
    "slice_size",
    "rollback_plan"
  ],
  "steps": [
    "Define the old behavior, new behavior, compatibility window, rollback point, and safety checks.",
    "Choose the thinnest vertical slice that proves the migration pattern end to end.",
    "Ship compatibility scaffolding before moving callers or data.",
    "Move one slice, verify dual-read or equivalent correctness where practical, and keep rollback possible.",
    "Retire old paths only after all slices are verified and observability shows no drift."
  ],
  "checks": [
    "slice is independently verifiable",
    "rollback path preserved",
    "data correctness checked",
    "old and new paths monitored"
  ],
  "stopConditions": [
    "migration complete and old path removed",
    "drift or rollback risk exceeds threshold",
    "approval-gated step reached"
  ],
  "evidence": [
    "migration plan",
    "slice checklist",
    "verification output",
    "rollback notes"
  ],
  "humanApproval": [
    "data deletion",
    "schema destructive changes",
    "public API removal"
  ],
  "version": "0.1.0",
  "updated": "2026-06-20",
  "author": "Palette Lab",
  "license": "MIT",
  "compatibleAgents": [
    "codex",
    "github-copilot",
    "claude",
    "claude-code",
    "cursor",
    "aider",
    "goose",
    "opencode",
    "gemini-cli",
    "google-ai-studio",
    "google-antigravity"
  ],
  "prompt": "Use the Migration Slice Loop for [migration_goal, slice_size, rollback_plan].\n\nFirst define the task boundary, success criteria, allowed actions, required evidence, risk level, and budget. Work in bounded iterations. In each iteration:\n- Define the old behavior, new behavior, compatibility window, rollback point, and safety checks.\n- Choose the thinnest vertical slice that proves the migration pattern end to end.\n- Ship compatibility scaffolding before moving callers or data.\n- Move one slice, verify dual-read or equivalent correctness where practical, and keep rollback possible.\n- Retire old paths only after all slices are verified and observability shows no drift.\n\nQuality gates before completion:\n- slice is independently verifiable\n- rollback path preserved\n- data correctness checked\n- old and new paths monitored\n\nStop when one of these is true:\n- migration complete and old path removed\n- drift or rollback risk exceeds threshold\n- approval-gated step reached\n\nFinish with:\n- migration plan\n- slice checklist\n- verification output\n- rollback notes\n\nEscalate for human approval before: data deletion, schema destructive changes, public API removal."
}
