{
  "id": "monorepo-boundary-guard",
  "title": "Monorepo Boundary Guard Loop",
  "category": "engineering",
  "summary": "Prevents accidental cross-package coupling in monorepos by enforcing boundaries and local checks.",
  "tags": [
    "monorepo",
    "architecture",
    "packages"
  ],
  "useCases": [
    "workspace cleanup",
    "package extraction",
    "ownership enforcement"
  ],
  "riskLevel": "medium",
  "inputs": [
    "workspace",
    "boundary_rule",
    "affected_packages"
  ],
  "steps": [
    "Document the intended ownership and dependency direction for the affected packages.",
    "Scan imports, build configs, tests, and scripts for boundary violations.",
    "Fix the highest-risk violation by moving shared code, adding a public interface, or reversing the dependency.",
    "Add a lightweight automated guard such as lint, package constraints, or a dependency check.",
    "Run affected package tests and a workspace-level boundary validation."
  ],
  "checks": [
    "dependency direction documented",
    "violations removed or accepted",
    "guard added",
    "affected packages pass"
  ],
  "stopConditions": [
    "no unaccepted violation remains in scope",
    "ownership decision is blocked",
    "budget ends"
  ],
  "evidence": [
    "boundary map",
    "violation list",
    "guard output",
    "changed package list"
  ],
  "humanApproval": [
    "package ownership changes",
    "large code moves"
  ],
  "version": "0.1.0",
  "updated": "2026-06-20",
  "author": "Palette Lab",
  "license": "MIT",
  "compatibleAgents": [
    "codex",
    "github-copilot",
    "claude",
    "claude-code",
    "cursor",
    "aider",
    "goose",
    "opencode",
    "gemini-cli",
    "google-ai-studio",
    "google-antigravity"
  ],
  "prompt": "Use the Monorepo Boundary Guard Loop for [workspace, boundary_rule, affected_packages].\n\nFirst define the task boundary, success criteria, allowed actions, required evidence, risk level, and budget. Work in bounded iterations. In each iteration:\n- Document the intended ownership and dependency direction for the affected packages.\n- Scan imports, build configs, tests, and scripts for boundary violations.\n- Fix the highest-risk violation by moving shared code, adding a public interface, or reversing the dependency.\n- Add a lightweight automated guard such as lint, package constraints, or a dependency check.\n- Run affected package tests and a workspace-level boundary validation.\n\nQuality gates before completion:\n- dependency direction documented\n- violations removed or accepted\n- guard added\n- affected packages pass\n\nStop when one of these is true:\n- no unaccepted violation remains in scope\n- ownership decision is blocked\n- budget ends\n\nFinish with:\n- boundary map\n- violation list\n- guard output\n- changed package list\n\nEscalate for human approval before: package ownership changes, large code moves."
}
