{
  "id": "judge-rubric-sanity",
  "title": "Judge Rubric Sanity Loop",
  "category": "evaluation",
  "summary": "Validates an automated judge rubric against anchors, counterexamples, and known bad outputs.",
  "tags": [
    "llm-judge",
    "rubric",
    "evaluation"
  ],
  "useCases": [
    "automated QA",
    "prompt experiments",
    "agent scoring"
  ],
  "riskLevel": "medium",
  "inputs": [
    "judge_prompt",
    "anchor_cases",
    "failure_examples"
  ],
  "steps": [
    "Define the exact dimensions the judge should score and the dimensions it must ignore.",
    "Create anchors for excellent, acceptable, borderline, and unacceptable outputs.",
    "Run the judge on anchors, adversarially polished bad answers, and boring correct answers.",
    "Revise the rubric to reward evidence and task completion over style or confidence.",
    "Freeze the judge version before using it to compare systems."
  ],
  "checks": [
    "anchors score in expected order",
    "polished bad answers fail",
    "boring correct answers pass",
    "judge version frozen"
  ],
  "stopConditions": [
    "judge behaves acceptably on sanity set",
    "rubric cannot separate important cases",
    "budget ends"
  ],
  "evidence": [
    "anchor set",
    "judge scores",
    "rubric diff",
    "known weaknesses"
  ],
  "humanApproval": [
    "using judge as sole launch gate",
    "changing score thresholds"
  ],
  "version": "0.1.0",
  "updated": "2026-06-20",
  "author": "Palette Lab",
  "license": "MIT",
  "compatibleAgents": [
    "codex",
    "github-copilot",
    "claude",
    "claude-code",
    "cursor",
    "aider",
    "goose",
    "opencode",
    "gemini-cli",
    "google-ai-studio",
    "google-antigravity"
  ],
  "prompt": "Use the Judge Rubric Sanity Loop for [judge_prompt, anchor_cases, failure_examples].\n\nFirst define the task boundary, success criteria, allowed actions, required evidence, risk level, and budget. Work in bounded iterations. In each iteration:\n- Define the exact dimensions the judge should score and the dimensions it must ignore.\n- Create anchors for excellent, acceptable, borderline, and unacceptable outputs.\n- Run the judge on anchors, adversarially polished bad answers, and boring correct answers.\n- Revise the rubric to reward evidence and task completion over style or confidence.\n- Freeze the judge version before using it to compare systems.\n\nQuality gates before completion:\n- anchors score in expected order\n- polished bad answers fail\n- boring correct answers pass\n- judge version frozen\n\nStop when one of these is true:\n- judge behaves acceptably on sanity set\n- rubric cannot separate important cases\n- budget ends\n\nFinish with:\n- anchor set\n- judge scores\n- rubric diff\n- known weaknesses\n\nEscalate for human approval before: using judge as sole launch gate, changing score thresholds."
}
