{
  "id": "performance-budget-ratchet",
  "title": "Performance Budget Ratchet Loop",
  "category": "engineering",
  "summary": "Improves performance using repeatable measurements and prevents backsliding with a ratcheted budget.",
  "tags": [
    "performance",
    "benchmark",
    "latency"
  ],
  "useCases": [
    "page-load optimization",
    "API latency reduction",
    "build speed work"
  ],
  "riskLevel": "medium",
  "inputs": [
    "target_metric",
    "budget",
    "benchmark_command"
  ],
  "steps": [
    "Define the metric, measurement harness, warmup, sample count, and pass threshold before changing code.",
    "Record a baseline under stable conditions and identify the largest measured contributor.",
    "Change one lever at a time, rerun the same benchmark, and keep only changes that improve the target without regressions.",
    "After each accepted improvement, ratchet the budget to the new proven level or threshold.",
    "Add an automated performance guard where practical."
  ],
  "checks": [
    "baseline recorded",
    "same benchmark conditions used",
    "statistical noise considered",
    "functional tests still pass",
    "budget guard added or justified"
  ],
  "stopConditions": [
    "target metric met",
    "no safe improvement remains",
    "budget ends"
  ],
  "evidence": [
    "baseline and final measurements",
    "benchmark command",
    "accepted and rejected experiments",
    "guard configuration"
  ],
  "humanApproval": [
    "quality tradeoffs",
    "cache invalidation risk",
    "infrastructure cost increase"
  ],
  "version": "0.1.0",
  "updated": "2026-06-20",
  "author": "Palette Lab",
  "license": "MIT",
  "compatibleAgents": [
    "codex",
    "github-copilot",
    "claude",
    "claude-code",
    "cursor",
    "aider",
    "goose",
    "opencode",
    "gemini-cli",
    "google-ai-studio",
    "google-antigravity"
  ],
  "prompt": "Use the Performance Budget Ratchet Loop for [target_metric, budget, benchmark_command].\n\nFirst define the task boundary, success criteria, allowed actions, required evidence, risk level, and budget. Work in bounded iterations. In each iteration:\n- Define the metric, measurement harness, warmup, sample count, and pass threshold before changing code.\n- Record a baseline under stable conditions and identify the largest measured contributor.\n- Change one lever at a time, rerun the same benchmark, and keep only changes that improve the target without regressions.\n- After each accepted improvement, ratchet the budget to the new proven level or threshold.\n- Add an automated performance guard where practical.\n\nQuality gates before completion:\n- baseline recorded\n- same benchmark conditions used\n- statistical noise considered\n- functional tests still pass\n- budget guard added or justified\n\nStop when one of these is true:\n- target metric met\n- no safe improvement remains\n- budget ends\n\nFinish with:\n- baseline and final measurements\n- benchmark command\n- accepted and rejected experiments\n- guard configuration\n\nEscalate for human approval before: quality tradeoffs, cache invalidation risk, infrastructure cost increase."
}
