{
  "id": "api-contract-compatibility",
  "title": "API Contract Compatibility Loop",
  "category": "engineering",
  "summary": "Protects public APIs by testing backward compatibility, error contracts, and documentation before changes land.",
  "tags": [
    "api",
    "compatibility",
    "contracts"
  ],
  "useCases": [
    "SDK releases",
    "REST or GraphQL changes",
    "library public API updates"
  ],
  "riskLevel": "high",
  "inputs": [
    "api_surface",
    "change",
    "compatibility_policy"
  ],
  "steps": [
    "Identify public methods, endpoints, schemas, status codes, errors, rate limits, and documented examples affected by the change.",
    "Classify the change as additive, compatible behavior change, deprecation, or breaking change.",
    "Add contract tests or golden examples for current and intended behavior.",
    "Update docs and migration notes only after tests prove the contract.",
    "Escalate any breaking change that lacks versioning, migration, or approval."
  ],
  "checks": [
    "affected API surface listed",
    "compatibility class declared",
    "contract tests pass",
    "docs match tests",
    "migration path exists if needed"
  ],
  "stopConditions": [
    "compatible change is ready",
    "breaking change needs approval",
    "policy conflict blocks work"
  ],
  "evidence": [
    "API surface table",
    "contract test output",
    "docs diff",
    "compatibility decision"
  ],
  "humanApproval": [
    "breaking change",
    "removing deprecated API",
    "changing rate limits"
  ],
  "version": "0.1.0",
  "updated": "2026-06-20",
  "author": "Palette Lab",
  "license": "MIT",
  "compatibleAgents": [
    "codex",
    "github-copilot",
    "claude",
    "claude-code",
    "cursor",
    "aider",
    "goose",
    "opencode",
    "gemini-cli",
    "google-ai-studio",
    "google-antigravity"
  ],
  "prompt": "Use the API Contract Compatibility Loop for [api_surface, change, compatibility_policy].\n\nFirst define the task boundary, success criteria, allowed actions, required evidence, risk level, and budget. Work in bounded iterations. In each iteration:\n- Identify public methods, endpoints, schemas, status codes, errors, rate limits, and documented examples affected by the change.\n- Classify the change as additive, compatible behavior change, deprecation, or breaking change.\n- Add contract tests or golden examples for current and intended behavior.\n- Update docs and migration notes only after tests prove the contract.\n- Escalate any breaking change that lacks versioning, migration, or approval.\n\nQuality gates before completion:\n- affected API surface listed\n- compatibility class declared\n- contract tests pass\n- docs match tests\n- migration path exists if needed\n\nStop when one of these is true:\n- compatible change is ready\n- breaking change needs approval\n- policy conflict blocks work\n\nFinish with:\n- API surface table\n- contract test output\n- docs diff\n- compatibility decision\n\nEscalate for human approval before: breaking change, removing deprecated API, changing rate limits."
}
